{
  "$schema": "./threat-model-v1.schema.json",
  "schemaVersion": 1,
  "modelVersion": "1.0.0-local.5",
  "status": "local-development-security-contract",
  "updatedAt": "2026-07-15",
  "scope": {
    "included": [
      "Torium chain binary and deterministic state transitions",
      "validator, node, operator, governance, upgrade, faucet, deployer, and release keys",
      "genesis supply, staking, fees, modules, precompiles, and system contracts",
      "P2P, RPC, WebSocket, REST, gRPC, explorer, indexer, metrics, and support surfaces",
      "snapshots, state sync, backups, restore, release, CI, SDK, docs, and local examples"
    ],
    "excluded": [
      "Torium product backend and mobile integration",
      "bridges, IBC runtime, Ethereum L2, and rollup settlement",
      "live-value migration, TGE, exchange integration, and mainnet launch",
      "infrastructure purchase or public deployment"
    ],
    "publicDeploymentAuthorized": false
  },
  "sources": {
    "protocol": {
      "path": "../config/protocol-v1.json",
      "version": "1.0.0-local.5"
    },
    "trustModel": {
      "path": "../config/trust-model-v1.json",
      "version": "1.0.0-local.5"
    },
    "secretPolicy": {
      "path": "./secret-policy.json",
      "version": "1.0.0",
      "scanner": "../scripts/scan-prohibited-secrets.mjs"
    },
    "upstreamSupport": "../poc/upstream-baseline/support-matrix.json"
  },
  "methodology": {
    "riskScore": "likelihood-times-impact",
    "likelihoodScale": {
      "1": "rare",
      "2": "unlikely",
      "3": "possible",
      "4": "likely",
      "5": "expected-or-continuous"
    },
    "impactScale": {
      "1": "negligible",
      "2": "minor",
      "3": "material-local-degradation",
      "4": "major-loss-or-prolonged-outage",
      "5": "consensus-safety-supply-key-or-release-compromise"
    },
    "severityThresholds": {
      "critical": { "minimum": 20, "maximum": 25 },
      "high": { "minimum": 12, "maximum": 19 },
      "medium": { "minimum": 6, "maximum": 11 },
      "low": { "minimum": 1, "maximum": 5 }
    },
    "reviewRule": "every high or critical risk requires prevention, detection, recovery, owners, tests, review triggers, and a blocking public-release gate"
  },
  "assets": [
    {
      "id": "A01",
      "name": "validator consensus keys and signer state",
      "properties": ["confidentiality", "non-equivocation", "availability"]
    },
    {
      "id": "A02",
      "name": "validator operator, governance, upgrade, faucet, and deployer keys",
      "properties": ["confidentiality", "least-privilege", "accountability"]
    },
    {
      "id": "A03",
      "name": "genesis supply, allocations, chain IDs, and checksums",
      "properties": ["integrity", "reproducibility", "replay-separation"]
    },
    {
      "id": "A04",
      "name": "consensus and application state",
      "properties": ["determinism", "safety", "availability"]
    },
    {
      "id": "A05",
      "name": "governance parameters and upgrade plans",
      "properties": ["authorization", "timelock", "auditability"]
    },
    {
      "id": "A06",
      "name": "snapshots, backups, state-sync trust anchors, and historical evidence",
      "properties": ["integrity", "availability", "freshness"]
    },
    {
      "id": "A07",
      "name": "P2P, JSON-RPC, WebSocket, REST, gRPC, and operator endpoints",
      "properties": ["availability", "authenticity", "bounded-resource-use"]
    },
    {
      "id": "A08",
      "name": "valueless tTOR faucet signer, balance, budgets, and queue",
      "properties": ["least-privilege", "availability", "abuse-resistance"]
    },
    {
      "id": "A09",
      "name": "precompiles, system contracts, deployment registry, and emitted events",
      "properties": ["authorization", "state-integrity", "event-authenticity"]
    },
    {
      "id": "A10",
      "name": "source, CI, dependencies, binaries, containers, SBOMs, signatures, and provenance",
      "properties": ["integrity", "reproducibility", "authenticity"]
    },
    {
      "id": "A11",
      "name": "SDK chain metadata, transports, transaction lifecycle, and documentation",
      "properties": [
        "integrity",
        "endpoint-authenticity",
        "semantic-correctness"
      ]
    },
    {
      "id": "A12",
      "name": "logs, traces, metrics, screenshots, fixtures, examples, and support bundles",
      "properties": ["confidentiality", "redaction", "bounded-retention"]
    },
    {
      "id": "A13",
      "name": "explorer and indexer canonical views",
      "properties": ["completeness", "freshness", "canonicality"]
    },
    {
      "id": "A14",
      "name": "native balances, staking power, fees, rewards, and accounting",
      "properties": ["conservation", "precision", "authorization"]
    }
  ],
  "actors": [
    {
      "id": "ACT01",
      "name": "local Torium authority",
      "trust": "controls all local validators and can reset valueless localnet"
    },
    {
      "id": "ACT02",
      "name": "future independent validator operator",
      "trust": "trusted only for its own keys and declared voting power"
    },
    {
      "id": "ACT03",
      "name": "wallet, SDK, contract, and RPC user",
      "trust": "untrusted input producer"
    },
    {
      "id": "ACT04",
      "name": "malicious validator coalition",
      "trust": "Byzantine within or beyond the stated fault threshold"
    },
    {
      "id": "ACT05",
      "name": "external network attacker",
      "trust": "untrusted; may scan, flood, partition, spoof, or exploit"
    },
    {
      "id": "ACT06",
      "name": "compromised operator or host",
      "trust": "adversarial with stolen runtime access"
    },
    {
      "id": "ACT07",
      "name": "dependency, image, toolchain, or CI supply-chain attacker",
      "trust": "may publish or substitute malicious inputs"
    },
    {
      "id": "ACT08",
      "name": "faucet, RPC, mempool, and resource abuser",
      "trust": "automated and economically unconstrained on valueless networks"
    },
    {
      "id": "ACT09",
      "name": "malicious contract or precompile caller",
      "trust": "arbitrary EVM and cross-module call sequences"
    },
    {
      "id": "ACT10",
      "name": "release, governance, or metadata maintainer",
      "trust": "privileged only through reviewed, attributable workflows"
    },
    {
      "id": "ACT11",
      "name": "explorer, indexer, snapshot, and RPC operator",
      "trust": "not a consensus authority; output requires verification"
    }
  ],
  "boundaries": [
    {
      "id": "B01",
      "name": "client to public RPC",
      "controls": [
        "TLS when public",
        "chain-ID validation",
        "body, batch, time, origin, and rate limits"
      ],
      "ownerIssues": [114, 120, 130, 135]
    },
    {
      "id": "B02",
      "name": "internet or sentry to validator P2P",
      "controls": [
        "sentry isolation",
        "peer limits",
        "address-book and eclipse monitoring"
      ],
      "ownerIssues": [114, 119, 120, 124]
    },
    {
      "id": "B03",
      "name": "validator node to consensus signer",
      "controls": [
        "separate key custody",
        "last-sign state",
        "no cloned signer",
        "compromise runbook"
      ],
      "ownerIssues": [100, 117, 119]
    },
    {
      "id": "B04",
      "name": "CometBFT consensus to Cosmos application",
      "controls": [
        "deterministic ABCI execution",
        "proposal validation",
        "app-hash equality"
      ],
      "ownerIssues": [94, 107, 119, 121]
    },
    {
      "id": "B05",
      "name": "EVM to Cosmos modules through precompiles",
      "controls": [
        "explicit composition",
        "authorization preservation",
        "revert atomicity",
        "fuzz and invariant tests"
      ],
      "ownerIssues": [94, 107, 111]
    },
    {
      "id": "B06",
      "name": "governance proposal to privileged state or binary upgrade",
      "controls": [
        "documented authority",
        "versioned plan",
        "simulation",
        "upgrade rehearsal"
      ],
      "ownerIssues": [106, 119, 126]
    },
    {
      "id": "B07",
      "name": "source and dependencies to release artifacts",
      "controls": [
        "immutable pins",
        "clean builders",
        "checksums",
        "SBOM",
        "signatures",
        "provenance"
      ],
      "ownerIssues": [121, 122, 126]
    },
    {
      "id": "B08",
      "name": "snapshot or state-sync provider to node state",
      "controls": [
        "trusted height and hash",
        "checksums",
        "independent verification",
        "restore rehearsal"
      ],
      "ownerIssues": [98, 116, 119, 123]
    },
    {
      "id": "B09",
      "name": "canonical chain to explorer and indexer view",
      "controls": [
        "finalized-height tracking",
        "reorg or reset detection",
        "backfill reconciliation"
      ],
      "ownerIssues": [112, 113, 119, 131]
    },
    {
      "id": "B10",
      "name": "public faucet request to isolated signer and RPC",
      "controls": [
        "idempotency",
        "budgets",
        "rate and risk limits",
        "bounded queue",
        "hot-wallet cap"
      ],
      "ownerIssues": [97, 120, 125, 172]
    },
    {
      "id": "B11",
      "name": "standalone chain to existing Torium product",
      "controls": [
        "no imports",
        "no auth or database dependency",
        "no shared secrets",
        "separate future adapter"
      ],
      "ownerIssues": [84, 94, 128]
    },
    {
      "id": "B12",
      "name": "operator state to logs, screenshots, and support bundles",
      "controls": [
        "redaction",
        "secret scan",
        "staging-directory gate",
        "retention and access policy"
      ],
      "ownerIssues": [115, 120, 121, 126]
    }
  ],
  "risks": [
    {
      "id": "T001",